[
  {
    "candidate_id": "cand_01",
    "name": "Alex Chen",
    "email": "alex.chen@example.com",
    "phone": "+1-555-0101",
    "skills": ["Python", "React", "FastAPI", "PostgreSQL", "Docker", "Git", "Kubernetes", "AWS"],
    "resume_text": "Alex Chen is a Staff Software Engineer with 10 years of experience. Expert in Python backend development using FastAPI and Django. Strong frontend capabilities with React. Experienced in database design with PostgreSQL and container orchestration with Docker and Kubernetes. Spearheaded architectural changes at previous roles leading to 40% performance gains. Strong leadership and team collaboration.",
    "years_experience": 10,
    "current_title": "Staff Software Engineer",
    "previous_titles": ["Senior Software Engineer", "Software Engineer", "Junior Developer"],
    "education": {
      "degree": "Masters",
      "field": "Computer Science",
      "institution": "Stanford University",
      "graduation_year": 2016
    },
    "domains": ["SaaS", "FinTech", "AI"],
    "leadership_examples": "Led a team of 6 engineers to rebuild the core ingestion platform, improving scalability.",
    "conflict_resolution": "Facilitate open discussion and base decisions on data and metrics rather than personal opinions.",
    "collaboration_style": "Collaborative, active in peer review, mentoring junior engineers.",
    "flags": {
      "visa_required": false,
      "notice_period_days": 30,
      "willing_to_relocate": true
    }
  },
  {
    "candidate_id": "cand_02",
    "name": "Maria Santos",
    "email": "maria.santos@example.com",
    "phone": "+1-555-0102",
    "skills": ["Python", "PyTorch", "scikit-learn", "AWS", "Kubernetes", "FastAPI", "SQL", "Git"],
    "resume_text": "Maria Santos is a Senior Machine Learning Engineer with 6 years of experience. Specialized in training and deploying deep learning models using PyTorch and scikit-learn. Expert in building low-latency ML APIs with FastAPI and deploying on AWS using Kubernetes. Strong background in data pipelines and PostgreSQL database management.",
    "years_experience": 6,
    "current_title": "Senior ML Engineer",
    "previous_titles": ["ML Engineer", "Data Scientist"],
    "education": {
      "degree": "PhD",
      "field": "Artificial Intelligence",
      "institution": "MIT",
      "graduation_year": 2020
    },
    "domains": ["AI", "Cloud", "Healthcare"],
    "leadership_examples": "Mentored 3 junior ML engineers and led the transition of models to production pipelines.",
    "conflict_resolution": "I encourage retrospective meetings to address process gaps and keep conversations professional.",
    "collaboration_style": "Cross-functional collaborator, working closely with product managers and backend devs.",
    "flags": {
      "visa_required": false,
      "notice_period_days": 15,
      "willing_to_relocate": false
    }
  },
  {
    "candidate_id": "cand_03",
    "name": "Rohan Gupta",
    "email": "rohan.gupta@example.com",
    "phone": "+91-99999-0103",
    "skills": ["Java", "C++", "SQL", "Git", "HTML", "CSS", "Python"],
    "resume_text": "Rohan Gupta is an Associate Software Engineer with 1 year of experience. Experienced in Java development, C++ programming, and database queries with SQL. Strong foundation in HTML, CSS, and basic scripting with Python. Graduated with honors in Computer Science. Looking to contribute and grow in a fast-paced environment.",
    "years_experience": 1,
    "current_title": "Associate Software Engineer",
    "previous_titles": ["Intern"],
    "education": {
      "degree": "Bachelors",
      "field": "Information Technology",
      "institution": "IIT Delhi",
      "graduation_year": 2025
    },
    "domains": ["EdTech", "FinTech"],
    "leadership_examples": "Led a university project team to build a campus portal.",
    "conflict_resolution": "Listen to all points of view and seek compromise or refer to the advisor's guidance.",
    "collaboration_style": "Eager to learn, supportive teammate, communicates progress transparently.",
    "flags": {
      "visa_required": false,
      "notice_period_days": 0,
      "willing_to_relocate": true
    }
  },
  {
    "candidate_id": "cand_04",
    "name": "Sarah Jenkins",
    "email": "sarah.j@example.com",
    "phone": "+1-555-0104",
    "skills": ["React", "TypeScript", "Node.js", "Express", "MongoDB", "CSS", "Git"],
    "resume_text": "Sarah Jenkins is a Frontend Engineer with 4 years of experience. Expert in React and TypeScript. Well-versed in Node.js and Express backend development. Built and maintained several web applications with MongoDB as database. Dedicated to creating responsive, accessible user interfaces with rich user experiences.",
    "years_experience": 4,
    "current_title": "Frontend Engineer",
    "previous_titles": ["Junior Frontend Developer"],
    "education": {
      "degree": "Bachelors",
      "field": "Computer Science",
      "institution": "UT Austin",
      "graduation_year": 2022
    },
    "domains": ["Web Development", "E-commerce"],
    "leadership_examples": "Led the redesign of the user onboarding flow, reducing bounce rate by 15%.",
    "conflict_resolution": "Discuss design options with team members and choose the one that benefits the user most.",
    "collaboration_style": "Active communicator, pair programmer, values design feedback.",
    "flags": {
      "visa_required": false,
      "notice_period_days": 30,
      "willing_to_relocate": false
    }
  },
  {
    "candidate_id": "cand_05",
    "name": "Devin Murphy",
    "email": "devin.murphy@example.com",
    "phone": "+1-555-0105",
    "skills": ["Go", "Docker", "Kubernetes", "AWS", "gRPC", "PostgreSQL", "Git"],
    "resume_text": "Devin Murphy is a Cloud Infrastructure Engineer with 5 years of experience. Specialized in building highly concurrent microservices in Go. Expert in Docker containerization and Kubernetes orchestration. Skilled in AWS cloud deployments, gRPC communications, and PostgreSQL query tuning.",
    "years_experience": 5,
    "current_title": "Cloud Engineer",
    "previous_titles": ["Systems Administrator", "Junior DevOps"],
    "education": {
      "degree": "Bachelors",
      "field": "Software Engineering",
      "institution": "University of Washington",
      "graduation_year": 2021
    },
    "domains": ["Cloud", "DevOps"],
    "leadership_examples": "Spearheaded migration of legacy services to Kubernetes, reducing hosting costs by 20%.",
    "conflict_resolution": "I look for technical root causes and set up automated checks to prevent recurring arguments.",
    "collaboration_style": "Documentation-focused, automates everything, supports operations teams.",
    "flags": {
      "visa_required": false,
      "notice_period_days": 30,
      "willing_to_relocate": true
    }
  },
  {
    "candidate_id": "cand_06",
    "name": "Ananya Sharma",
    "email": "ananya.sharma@example.com",
    "phone": "+91-99999-0106",
    "skills": ["Python", "FastAPI", "SQLAlchemy", "MySQL", "Redis", "Git", "Docker"],
    "resume_text": "Ananya Sharma is a Backend Engineer with 3 years of experience. Focuses on building reliable web services in Python using FastAPI, SQLAlchemy, and MySQL. Experienced in using Redis for caching and session management. Proficient with Git and Docker.",
    "years_experience": 3,
    "current_title": "Backend Developer",
    "previous_titles": ["Software Engineer"],
    "education": {
      "degree": "Bachelors",
      "field": "Computer Science",
      "institution": "BITS Pilani",
      "graduation_year": 2023
    },
    "domains": ["FinTech", "SaaS"],
    "leadership_examples": "Designed and implemented a database migration plan that minimized downtime.",
    "conflict_resolution": "I bring technical design alternatives to the whiteboard and evaluate trade-offs together.",
    "collaboration_style": "Detail-oriented, thorough coder, values clean code and unit testing.",
    "flags": {
      "visa_required": false,
      "notice_period_days": 60,
      "willing_to_relocate": true
    }
  },
  {
    "candidate_id": "cand_07",
    "name": "Jane Smith",
    "email": "jane.smith@example.com",
    "phone": "+1-555-0107",
    "skills": ["HR", "Recruitment", "Communication", "Management", "Negotiation"],
    "resume_text": "Jane Smith is an HR Manager with 8 years of experience. Experienced in corporate recruiting, talent sourcing, employee onboarding, performance management, and salary negotiations. Strong verbal and written communication skills. Seeking to lead an HR team.",
    "years_experience": 8,
    "current_title": "HR Manager",
    "previous_titles": ["Recruiter", "HR Specialist"],
    "education": {
      "degree": "Bachelors",
      "field": "Human Resources",
      "institution": "Boston University",
      "graduation_year": 2018
    },
    "domains": ["Corporate Services", "Recruitment"],
    "leadership_examples": "Managed a team of 3 recruiters, increasing hiring speed by 25%.",
    "conflict_resolution": "Listen actively, demonstrate empathy, and find a win-win solution for both employees and management.",
    "collaboration_style": "People-oriented, encouraging, open and clear communicator.",
    "flags": {
      "visa_required": false,
      "notice_period_days": 30,
      "willing_to_relocate": false
    }
  },
  {
    "candidate_id": "cand_08",
    "name": "Mark Zuckerberg",
    "email": "mark.z@example.com",
    "phone": "+1-555-0108",
    "skills": ["C++", "PHP", "System Design", "Product Strategy", "Management"],
    "resume_text": "Mark Zuckerberg is a Tech Founder and Executive. Strong technical background in C++, PHP, and web systems design. Led product strategy and grew platforms to billions of users. Expert in scaling organizations and engineering operations.",
    "years_experience": 22,
    "current_title": "CEO",
    "previous_titles": ["Founder", "Lead Developer"],
    "education": {
      "degree": "High School",
      "field": "Computer Science",